Reviews,Verdict
 Quality of the laptop is very pathetic.Because of bad quality it stopped working even before 2 months.I gave it for service and they are not ready to replace with new one.It's motherboard got damaged. MI told they will replace it. I will update after that. Whether it is working or not.On 18th may i received the laptop but still it's having problem. Now MI service center saying display issue. Need to replace display.I will updateUpdate Jun 7/2022: I received the laptop after repair. Initially they didn't change the mother board. Now only mother board replaced. I don't think that it will last even for 1 year. so extended the warranty for 3 years after spending 3500rs.My verdict: Don't buy this crap. Buy only from other established brands,0
"I was confused between this laptop and some models of MSI. My requirements were very clear - good processor, decent amount of RAM, Light weight laptop, wanted really good battery life (because I travel a lot), something that doesn't gets too much heated.So I chose this Laptop after reading all those reviews on the product, after using it for 3 weeks I can tell it fulfilled only a few of mine requirements.1. Laptop is lighter than other normal laptops2. Processor is decent3. Screen is pretty goodthat's it.Now some of the things that you should be aware about this laptop:1. It gets heated too badly. I'm not even playing games man. Just a bunch of Chrome Tabs with Youtube playing songs in one and other normal surfing. And it's overheating so much.2. I read other reviews that Speakers are crappy - but I thought it might have little less volume than other laptops. And as I mostly use my headphones while working. But man the speakers of this laptop are really crappy. My friend came, I wanted to show hima quick YouTube video and we could barely hear anyhting coming from the laptop. The sound is that bad. My 4 year old phone has got better speaker than this pice of shite.3. Programs are abruptly ending sometime - it just crashes for no reasons. I have never seen anything like that in ages. I paid so much money for this laptop which can hardly run decent size softwares.4. Battery life was very important to me, and as other reviews said 6-7 hours of usage time on this machine, I believed it to be true. But it hardly works for 2-3 hours.Also, the charging speed is very slow.These are the things that make me puke on this device. It took me 2-3 weeks to figure out that I've not spent my 65k but burnt my hard-earned 65k. Should have waited some time to buy Mac Air 2020.  But i made a huge mistake.",1
Please don't buy this product .Pros:Nice screenSlimMac book feel16GB i7 is superfastCons:Build feels poor in the bottom.The grill vent in the bottom is very poor and can bend even with mild press.Speakers sound is lowSpeakers get blocked on soft surfaces and you don't hear anything.Battery performance is 30 percent less than what they claim on website.After One month..The laptop is NOMORE running on the battery.It gets turned off when I remove charger. I should take to it service center now and feel ashamed for buying such poor product.Please buy a better one.,0
"It's an almost perfect laptop with three things I would have liked to call a perfect one. Camera quality, Speaker and rather than 3.2K they could have gone for 4K resolution. The camera is okay but could have been better. Speaker is below average in terms of quality as well as loudness. Other than these Xiaomi has pulled a masterstroke here and the future laptops may get even better.",1
"This is the first time i am writing a review for a product that I'm using past 6months. am usually very choosy when it comes to finding right product. This laptop is chosen after a lot of research. Found really good when compared with laptops of other companies in the same price range. Totally happy with the display quality & build quality. Graphic intensive games might not like best in this range, but believe me in this price you won't get this level screen quality & build quality. forget about this level you won't get half of this level build quality.",0
" Screen - PerfectProcessing - perfect for light video editing, multiple browsing tabs, and background audio streaming....all at the same time1 touch login - is excellentCamera is also good...for meetings - decent qualityLight games also run smooth, 84fps render speedHeating is a bit of concern, altho...H series processors are known to give out high heat....so that is kind of okay...Trackpad is also normal and idk why people said it's faulty....for me it's good...Battery life - Well decent 4 - 5 hrs backupAll in all....VALUE FOR MONEY. Got it for 58K due to bank offers.",0
"Don't buy mi laptop's fully hanging problem and heating after shutdown also battery drain after shutdown, power button not working properly and switch off like power cut while working.. Hanging 6to 8 times per day. Power button should press nearly 5 to 6 times to on the laptop...",0
"Was so confused when my eight year old Asus turned slow as a sloth and started looking for a good laptop that fits my needs. I'm a regular laptop user - no gaming, photo or video editing or other graphic-heavy tasks.My uses were regular browsing, media consumption and productivity uses. I had shortlisted the Lenevo Ideapad 5, Dell Inspiron 15 series, and Asus Vivobook K15 OLED along with this MI Notebook Ultra. As I was not the one who doesn't go after brand value per se, (Not a Maruti Suzuki/Hero Honda fan, OnePlus over Samsung) the brand value of Dell wasn't a factor in my decision making, but the after sales service was. The MI Notebook Ultra isn't cheaper either as you could get the Dell model with similar specs at almost the same price.Finally I choose to go with the MI Notebook Ultra as I felt all other laptops have inferior display except the Asus K15 OLED. We all are spoilt by the amazing high quality super Amoled displays with high refresh rates, I was sure I would get affected by the inferior displays of other models mentioned here and can affect my media consumption experience a lot. Other factors that made me choose this one over others is the build quality of this one which feels pretty solid as it has an all-metal body while all others in the list has plastic elements in it which feels cheap and fragile.Things that can be adversely affect your decision to buy this one - MI is relatively new to the market and doesn't have much experience in building laptops.MI phones brand recognition is often associated with its crappy UI and phones filled with bloatwares, but I can assure that here, it does not matter as laptop comes pre-installed with clean Windows OS.Regarding the thermals, I've observed that the laptop tends to heat a little bit when it is being charged and used at the same time.Suggestions for improvement - Lack of privacy shutter for the front camera. I feel it is a huge deal since we can often forget to turn off the video during online meetings and this an effective tool to make sure you're not seen.Lack of AMD Ryzen variants - Gone are days where Intel used to dominate the chip market since now Ryzen variants offer better performance than the similar Intel variants. I'd have happily hone with the Ryzen 5 5500u variant instead of the i5 11 variant if it was made available.Front camera should've been betterProspective buyers please keep in mind that the RAM is soldered and cannot be upgraded so try to get the 16 GB variant of your use case demands high RAM requirements.",1
"ohk so first of all.pros:-1.great display2.keyboard is very tactile and nice3.finger print scanner is just awesome4: overall no performance issues5.build quality is just great.i mean its just top of the line.1.79 kg umm you can't say it's light but yeah it's not that 3-4lg like those damnn gaming laptops 😂. it's quite slim.easily can be opened by one hand and let me tell u it helps a lot atleast you don't have to pur your coffee mug down to open the laptop 😂.(fyi guys:-i bought the i5 16 gb variant)you also must go 16 gb if you want to use it for like more than 2 years.cons:-1.trackpad quality is little disappointing imean it's great,but it's just that it fells a little how can i say that luke mushy or something like that you have to get used to it.2.heat yup let me tell you heat issues are there like even if u have a 16 gb variant and u are running like just 3-4 applications  it will get like more warmer than usuall.like on the f2-f3 keys and above section.so yeah you can expect more heating while doing extensive tasks.like video rendering or slight gaming.3.i don't know if this happened with me only or it was a bug but while set up i was facing a white screen issue after logging in my microsoft account.i had to re-start the laptop like couple of times,then the setup got completed.4.speakers those damnnn speakers.bc mera phone jyada tez sound krta hai un speakers se.i would recommend to get a mini Bluetooth speaker for content consumption.i download a app called audio relay,so it let me use my phone's speaker as a wireless speaker.ohk so that was all form my side",1
 😡😡after 3 days it was turning on but the display was black . no light in  worst experience from xiaomi .when you buy a product for 64k price you expect from that .. and in just three days😡😡,1
"Hi everyone just got my laptop from amazon yesterday @55K! (hdfc sale). Installed NFS underground, far cry 2, working smooth like a charm. 16gb rams is super fast and installation is faster than even desktop. Best part is its 4K screen and superb battery. Full charge in less than an hour, and backup for 6hrs in heavy use....u can stretch it more with reduced brightness and battery saver. Very sleek and handy, miss the num pad though. guys, i can understand that sound is a little low, but you workaround it. Go to DTS settings and turn up the equalizer (all buttons to full). This is increase at least 20% sound",1
"I bought this on 8th Sep. The laptop is good and definitely value for money.But there was no Mi extended warranty option when you buy from Amazon. I wrote to Amazon and the response was to contact in case I do not get any response by 17th. But on 18th the option of chat contact was also closed (return window closed on 17th, - I did not understand the connection as the question is not about return)nor did I get any response through email.  It is cheating as you pay the same price for curtailed benefits but you are not told of this upfront. This leaves bad tase in the whole buying experience. For the first time I am unhappy with both Amazon and Xiaomi.",1
"ProsGreat price to value proposition. Similar spec laptops cost twice as much from established brands.Beautiful 15.6 inch anti glare 16:10 aspect ratio matte screen. 16:10 ratio helps to see more lines in excel/word documents compared to 16:9 aspect ratio. But 16:9 seems more suited for viewing videos since no horizontal black bars at the top and bottom of screen.Elegant looks in full metallic body. Grey colour variant looks stunning. Like an affordable windows macbook. Solid built with no flex in the laptop body.Thunderbolt 4 port for versatile connectivity. Connect 2 4k monitors simultaneously from same thunderbolt port. Thunderbolt is exclusive to 11th gen Intel core i5/i7 and not available yet in AMD ryzen 7 series processors.Charge through either thunderbolt port or type c portMacro key which can be used to quick launch an app like chrome by drag and drop of app into the macro key input area.Battery charge indicator with 3 colours. Red for  charge less than 20, orange from 20 to 90 and green for charge more than 90 percentage.90hz display with 3k resolution. Scrolling very smooth. fn+s key to switch between 60hz and 90hz refresh rateCore i7 11th gen processor - breeze through normal workloads. Haven't heard the cooling fans kicking in yet.512gb nvme ssd for speedy launch of programming ide like pycharm.16gb ram - most of the time 8 gb freeIntel iris graphics - haven't tried any games yet but 4k YouTube videos are smooth.Wifi 6 and Bluetooth 5.1 for reliable connectivity.65w usb type c charger - full charge in 90 mins.Can use 65w mobile phone charger to charge this laptop.Fingerprint sensor and power button combined.Good loud speakers after enabling games mode on inbuilt dts app and turning on Equalizer.Lifetime validity Office 2019 included - get ready to work on excel Power point etc without spending additional for Microsoft office software. Activation also easy by giving personal email while launcing office app first time.Soft relatively silent keys with good travel and 2 levels of backlight for working at night. Comfortable to type for long.Usable 720p camera for zoom/teams call. Disable digital video stabilization setting from camera app else there will be delay in video.Close to 10 hour battery backup after full charge. Battery drain also reasonable under normal workloads. Battery stand by good.Large trackpad which is good and supports gestures like gentle single tap for left click, gentle tap with 2 fingers together for double click which removes need for press/click of trackpad. Configure touchpad options for better results.Good palm rejection and comfortable edges while typing on keyboard.Hinge closes in a smooth pleasant manner with enough cushioningHassle free exchange by Amazon for 7 year old base model macbook air.No cost emi for 3 monthsWhat could have been improved to make this laptop even better:Mi 67w sonic charger which has a slim profile should have been provided instead of the rather  uninspiring default legacy kind of looking LITEON company charger.Small size of shift key on right takes time to get used to. Could have been a normal size shift key.No dedicated sd card slot to quickly transfer photos from SLR to laptop. Have to rely on usb cables.No dedicated number keys even though laptop is a 15.6 inch one. Would have been better to have dedicated number keys while working on excel.Voice capture using inbuilt microphone not the loudest. Use a wired or wireless headphone for voice capture.A bit on heavier side while picking up.May be due to the grade 6 sandblasted aluminium used.Backlight doesn't stay on. Goes off after sometime of inactivity and has to be renabled. But it seems there is an option in bios to keep it on the whole time once selected.Default sound output from speakers not loud enough. Only once games mode is selected and equalizer is enabled from inbuilt dts app does the sound output cross 80 decibel.",1
" Pros 1. Good quality screen2. keypad ig good with backlit lights3. Sleek design4. Processor runs fastCons.1. Trackpad is very bad, very hard to press2.Sound is very very low almost 40% of my S20 Phone",1
"Everything is fine i doesn't like 3 things in it they are1) Touch Pad is Not up to the mark it's not giving any premium feel and not nice.2) 2×2W Speakers are very low.3) Charger inside the box is not the Xiaomi branded Charger they are giving other company charger named ""LITEON"" Brand.Rest of that everything is fine",0
The after sales support is not available as the login with fingerprint is not working,1
"Definitely a great purchase, ticks all the boxes for me.The speaker quality is a pass though. The screen is the best part about the laptop except for its brightness, though for me its fine as i always keep my brightness low.If you're looking for a capable windows business laptop at the right price, look no further.None of the big brands will match the same build quality and tech provided at this price.Go for it without any reservations, you will not regret it.",1
 This laptop has very poor soundRunning smoothly and quality is goodNo fan soundIssue is battery is hardly 5 to 6hr if use continue 4k video with full soundOverall it value for money as compared to similar products in the market I boughtnotebook ultra  i5 16gb 512gb at 62000 on 9/2/22Bad part is sound is very less and usb portnote: dispointment about design of exost fan heating on back in continue using,1
"The laptop has been proven to be a superior machine in terms of quality and performance despite a competitive price there has been some compromises to reduce the price such as absence of dedicated GPU, a card slotbut for a normal user like me it should not matter much so I'd give it a 4.5 stars a best buy itself, xiomi has created an ecosystem now and I've become a part of it",1
"I had bought the laptop in sep, and it just went blank after 2 months of use.The laptop was not getting charged or switching on.It's been in the service center for the past 18 days, with no solution to the problem.The customer service of Mi is so pathetic, with absolutely no follow up.Absolute waste of money.",1
"The Laptop is the best in the price range.Pros- Performance, Build Quality, Display, Battery, TrackpadCons- Keyboard a little Flimsy with a little flexThe sound problem can be resolved by playing with the DTS Control Panel.",1
"The laptop has been proven to be a superior machine in terms of quality and performance despite a competitive price there has been some compromises to reduce the price such as absence of dedicated GPU, a card slotbut for a normal user like me it should not matter much so I'd give it a 4.5 stars a best buy itself, xiomi has created an ecosystem now and I've become a part of it",0
" I brought this laptop around 20days ago in Amazon summer sale. Till now it is super fine. Everything look good. It is a  productive laptop. Screen resolution is damn good. It is so high that even Microsoft window can't able to handle some task. Boot time is around 10sec, shut down in 3 sec.Yeah, speaker is not good as like other specialization but I'm used to it. If you have bluetooth earphone it work very good with PC.Else then speaker evening is good and fine.Will post another review after user of 90 days.( Yes it is hard to believe some new product like xiaomi, realme in these products but beleive me you'll never be regret after buying. It is worth buying in this price segment. )",0
"Everything is fine i doesn't like 3 things in it they are1) Touch Pad is Not up to the mark it's not giving any premium feel and not nice.2) 2×2W Speakers are very low.3) Charger inside the box is not the Xiaomi branded Charger they are giving other company charger named ""LITEON"" Brand.Rest of that everything is fine",1
"This laptop is a step ahead from other known brands in this price range. Pre-installed Win 11 , Xe graphics with 8 gb GPU is wonderful.... Super slim and smooth design gives you a premium feeling. I m satisfied with Mi Notebook Ultra 👍",1
Every thing is good if sound is improved then it's unbeatable.,1
 The Speaker Quality is little low side. Screen resolution is awesome. Bazzels are perfect to the screen ratio. Fast performance 512GB/16GB. Wifi Connectivity is superfast. Bluetooth connectivity is too fast with bluetooth mouse.,1
"User experience is awesome. Screen display is too good. Metallic body, keys background light and battery backup are the best key features of this product. Only one draw back that is speaker volume. We won’t get much sound as get with others companies laptops. Apart from that this completely value for the money.",1
"Overall MI Notebook Ultra good product, good screen quality, good wifi 6 speed, windows 11 (update),booting speed is good, built quality is V good, but Speaker is little bit disappointing & also battery life about 6 hrs in balance mode after full charge , this is very disappointing. Theses demerits make average product in High price.",1
you cant get everything .. for such crisp display it gives only about 3 hours battery life.. that is also on balanced mode.,1
" This is my first laptop 💻 . I really appreciate the quality of laptop it's pure metallic & looks absolutely like true mackbook i know this because i have a mackbook so i know it very well , only one disappointed point it to give a more louder speaker but if you switch settings from music to gaming mode the speaker became too better not that much high like my mackbook but it's really fine because in such price it provides lot's of things in it & the battery lasts 11 hours continuously using YouTube  . My suggestion go for it ☺️.Thank you",0
"I got this laptop for 53k after exchange with my 10year old hp laptop. For this money i am very much satisfied with this laptop. Display is soo good. One of the best display in this price range. Speakers are very bad. I use bluetooth speaker. Can play casual games, but cannot be used for hard core gaming. Laptop is very light at 1.7kg it feels light weight for this screen size. I request everyone to go with ultra if you are looking for entertainment purpose. It really worth it.",1
" Don't scared of Chinese products, this is too good well built and contains all the best features. Small heat can be sensed while multi tasking but not when you are sitting under the fan or AC. SSD and processor make it supper fast and all their claims are right except battery. If you are going to use it for online classes (video mode on), you will get only 5-6 hours of battery life. If you are using normal task without internet, you will get 10 hours. Very slim, looks nice and professional but bulky",1
"Hi All,I am a devops engineer and I purchased it because I wanted to learn new technologies which requires high end configurations on your machine.I have used it for 2 days as of now but this laptop has live up to the expectations.Pros:1. Bright amazing screen.2. Super fast to use.Cons:1. MS Office is there but excel, word, ppt are not installed as individual app. They are running on cloud.2. Speakers sound is low.3. You have to install macro key software package from their repository on your own.",1
Awesome laptop for the price.Display 9/10Performance 9/10Build quality 10/10Battery 6/10Audio 6/10Webcam 7/10The audio and webcam are decent and good enough for video calls. For the battery I get somewhere around 5-6 hrs. I bought the laptop for app development.,1
"I got my laptop delivered today from Amazon. As I was looking for an extended warranty, I called mi.com and was asked to call oneassist to get the warranty. They offered extended two years warranty at 6499 while the same plan if purchased from mi.com along with the laptop is 3699.  I called mi customer care and the reason given was since you have purchased from Amazon, our partners can't provide you at the same rate and you should have bought from mi.com. Why is this not mentioned in Amazon or mi website as a disclaimer. I felt really cheated and this is not what I expected from Amazon nor Xiaomi.Updating after using for three months. Motherboard problem in three months. Can you imagine. The c c type charging port was not working and had given to an authorised service centre. It's been three weeks and no one called back after checking the issue. When I called they are saying motherhood issue and they have ordered the part and the company is not sending the part. They asked us to call and order the part. Pls don't buy MI PRODUCT. They don't provide good service nor extented warranty. Deeply regret for investing in this product",0
1. Open DTS Audio Processing2. Select Games Mode3. Open Graphic EQ and toggle it on4. Increase EQ volume of each band (I have set it to 5),0
"Please do not buy this brand laptop. I bought it on 16 March. After 3 months of using it, i can definitely say it is not worth buying. I have i5 11th gen 16gb 512gb varient. Still it hangs sometime even when i am not using internet on it. While watching videos, it hangs sometimes. And now it's screen is not working properly. The quality of screen was good but now it is not working all black. WTF. Only 3 month working screen. Now I have to go back and forth to mi center to claim warranty. I don't have time for that. Even most of you too.Always buy laptop from the brand who have name in their field. They are new and giving nothing right now.",0
 Too much heat and very poor audio quality,1
"1st day review, product received in good condition within time. Installation completes and windows activated. However, while restarting, an consecutive error (5 times) shows that ""ms team.exe - bad image"". Dont know why?",1
" Durability issuesLaptop  started getting issues in less than 2 months. The delete key is kind of stuck and is not coming outside. Had to take to service center and is taken for 1 week. He says there is some issue with delete and backspace keys, probably the mechanism is reversed. When i asked for a replacement he said, can not be done as it more than 10 days after purchase. So be careful with your money and go somewhere else, because you dont want to buy a laptop for 76+ and start going to service center from the second month onwards.",1
Pros:Great display..Great speed...Great metallic design...Great performance....Highly responsive fingerprint scanner..Typing feels marvelous..Battery backup satisfactorily upto 3hrs.. (we cannot expect much at this price range)Cons:Numeric keypad is absent.Speakers are down facing... Hence you won't feel that much sound.Grill vents in the downside of the laptop are bendable which I quite personally hate so much.Overall:Wonderful product at this price range. Buy it without a second thought.,1
"I was impressed with the specs on papers and yes it delivers that. Everyone has mentioned the pros but after using it for two months, now I think I am in a condition to answer the cons.Pros : you all know .Cons :1. Keyboard is trash. My key (Number 4) came out immediately after purchase. Even i am so fed up of the keyboard , I am using my bluetooth keyboard instead of it.2. When you lock your pc and login again, then suddenly the content on the web browser vanishes for like a long time and you loose control of your screen. Even after having a good processor with SSD, this should not happen.Rest I am happy with the experience.",0
Very nice performance but only One Issue Speaker Sound 🔊 Quantity is very very bad,1
