Reviews,Verdict
"Was so confused when my eight year old Asus turned slow as a sloth and started looking for a good laptop that fits my needs. I'm a regular laptop user - no gaming, photo or video editing or other graphic-heavy tasks.My uses were regular browsing, media consumption and productivity uses. I had shortlisted the Lenevo Ideapad 5, Dell Inspiron 15 series, and Asus Vivobook K15 OLED along with this MI Notebook Ultra. As I was not the one who doesn't go after brand value per se, (Not a Maruti Suzuki/Hero Honda fan, OnePlus over Samsung) the brand value of Dell wasn't a factor in my decision making, but the after sales service was. The MI Notebook Ultra isn't cheaper either as you could get the Dell model with similar specs at almost the same price.Finally I choose to go with the MI Notebook Ultra as I felt all other laptops have inferior display except the Asus K15 OLED. We all are spoilt by the amazing high quality super Amoled displays with high refresh rates, I was sure I would get affected by the inferior displays of other models mentioned here and can affect my media consumption experience a lot. Other factors that made me choose this one over others is the build quality of this one which feels pretty solid as it has an all-metal body while all others in the list has plastic elements in it which feels cheap and fragile.Things that can be adversely affect your decision to buy this one - MI is relatively new to the market and doesn't have much experience in building laptops.MI phones brand recognition is often associated with its crappy UI and phones filled with bloatwares, but I can assure that here, it does not matter as laptop comes pre-installed with clean Windows OS.Regarding the thermals, I've observed that the laptop tends to heat a little bit when it is being charged and used at the same time.Suggestions for improvement - Lack of privacy shutter for the front camera. I feel it is a huge deal since we can often forget to turn off the video during online meetings and this an effective tool to make sure you're not seen.Lack of AMD Ryzen variants - Gone are days where Intel used to dominate the chip market since now Ryzen variants offer better performance than the similar Intel variants. I'd have happily hone with the Ryzen 5 5500u variant instead of the i5 11 variant if it was made available.Front camera should've been betterProspective buyers please keep in mind that the RAM is soldered and cannot be upgraded so try to get the 16 GB variant of your use case demands high RAM requirements.",0
"Looks great, super display and  quite fast so far.Big disspointment is the charger and charging. It has the ugliest legacy looking charger i have seen in recent times.. and no we can't use any usb type c charger to charge the laptop. This is a real bummer, the thunderbolt port also doesny charge the laptop.The webcam and the speakers are also totally useless. So a video call was a disspointing experience.And the free office for home and student didn't get activated for me. All mi support could do was redirect me to a youtube video and microsoft directly. I wasn't able to work around the error msg: office home and student is not associated to your account. Hope it works for others.Happy with the build quality, display, wifi 6 and fast ports.Rest all is just gimick unless some miraculous software update can fix the speakers, webcam and charging options.",0
"This is the first time i am writing a review for a product that I'm using past 6months. am usually very choosy when it comes to finding right product. This laptop is chosen after a lot of research. Found really good when compared with laptops of other companies in the same price range. Totally happy with the display quality & build quality. Graphic intensive games might not like best in this range, but believe me in this price you won't get this level screen quality & build quality. forget about this level you won't get half of this level build quality.",1
"I managed to get the 16G i7 variant. I have been using laptop as daily driver. It's a good laptop but just a little workload gets the fan buzzing. Camera is trash and so can be said about audio. I have faced already power on issues 2-3 times in just 6 months. I will check if that issue happens again to report the issue (but as the issue is not persistent, when you report it's possible that it boot up every time during report and testing). Extended warrant plans on Amazon or in mi store is from Onsite Go or One Assist (one assist has bad customer reviews and in substantial numbers)Meanwhile, I got a chance to work on Macbook Air 2020 8G RAM 256 G ssd and it feels much smoother and audio quality is much much louder than Mi notebook and price around 79K-80K during offer period (camera is marginally better than Mi but not great in base macbook air which I used)",1
" Laptop is working on its own after enabling touchpad seems some internal issue in laptop as updated the drivers restarted many times but the problem is still the same.Considering the costing of the Laptop material is cheap and boot ime is more than expected the only good thing found till now is the sound of the laptop is good no complains on that. Delivery was also super fast by Amazon.Now raising the touchpad issue with Amazon lets see what happens.Will update accordingly.Update on 29th Jan Laptop replacement request taken by Amazon and new laptop is arriving tomorrow.But this seems some scam as the brand new seal packed laptop is a used one as you can see the laptop browser is already configured with some gmail id tojikdominic@gmail.com which is syncing the browser data payment methods cards and passwords.Kind Attension Please have these checked before you start using the laptop for any online purchase or before saving your password on the personal computer.Pathetic experience on return request for the product, Delivery & pickup service vendor of Amazon isn't trust worthy for such big amount purchases.Followedup for about 15 Days and many hours on their customer support to get my refund.",1
"Received the laptop with CHARGER. Good qualti at first impression and good speed so far. Two things I found could be better was, Brightness of the laptop is not high + speakers could be little more loud.I feel both as to be 80% of what they should be.",1
"I got my laptop delivered today from Amazon. As I was looking for an extended warranty, I called mi.com and was asked to call oneassist to get the warranty. They offered extended two years warranty at 6499 while the same plan if purchased from mi.com along with the laptop is 3699.  I called mi customer care and the reason given was since you have purchased from Amazon, our partners can't provide you at the same rate and you should have bought from mi.com. Why is this not mentioned in Amazon or mi website as a disclaimer. I felt really cheated and this is not what I expected from Amazon nor Xiaomi.Updating after using for three months. Motherboard problem in three months. Can you imagine. The c c type charging port was not working and had given to an authorised service centre. It's been three weeks and no one called back after checking the issue. When I called they are saying motherhood issue and they have ordered the part and the company is not sending the part. They asked us to call and order the part. Pls don't buy MI PRODUCT. They don't provide good service nor extented warranty. Deeply regret for investing in this product",1
"We'll crafted, light weight laptop with top notch internals. Value for money at this price range compared to other exclusive laptop brands .",1
"When the laptop is connected to charging point and I am not doing anything on the laptop, some process gets stuck (like edge) and CPU utilization goes high & the FAN starts making noise.if i disconnect the Charger then the problem goes away, another option is to go and kill the hanged application/process.I went to the service centre they did a software reinstall but its still not solved.Now i really want to return this fault product but as per amazon policy u can not return after 10 days, I am using this laptop for 45 days approx.  i am really not sure if mi can fix the issue ( or first identify ).i can foresee myself knocking the service Center door more often now.",1
"Balanced Battery Upto 5-6 Hours easily.Good WebcamSmooth PerformanceNot for GamingEveryday tasks like video editing,streaming Content can easily be achieved.",1
The speaker quality is worst. Even my normal phone speaker is higher volume than this. If the ceiling fan is running You will have to struggle to hear anything. And Amazon wont even take a return order.,1
"Purchased this 15 days ago, Was extremely happy for first 7 days - excellent performance.But Screen has already started flickering. Battery backup is poor, camera/sound are extremely disappointing.Not going to recommend this.  Never buying MI again.",1
"Except for poor speakers everything else is awesome. I mainly use this to develop android and full stack apps and this machine is a beast for my workflow. So , I highly recommend this to anyone looking for a new laptop.",1
"The laptop initially had heating issues. Gave it to the service center where the heat sink was replaced as it was defective. Then I started to face backlight screen bleeding issues. The engineers at the service center told me that it's how the laptop is manufactured. Utter crap! And now I'm facing issues with the bluetooth. Again gave it to the service center where a wifi-bluetooth card needs to be replaced. I mean what is going on. A brand new laptop worth Rs. 64,000/- and I'm already facing so many issues. A huge waste of money and peace. I'm pretty sure my unit is defective and everytime Xiaomi replaces the defective part and gives it back to me. I mean imagine that feeling you get of buying a new laptop just to repair it multiple times and use it. The laptop has spent more time in the service center than with me. Pretty sad situation!",0
One day it just stopped working,1
"Its pretty solid machine, so far its too good and value for money. Fingerprint is so fast display is too good.Spearker volume is not up to the mark",1
 It is dead in2day,1
" unable to boot. On/off is going, seems Os crashed",0
Am giving 3 start due to laptop experiencing little bit shock while charging. Remaing all are good for meCharger quality need to improve,1
"No slim book with 16 GB ram, 3.2k display and an aluminum chassis at this price. Would have loved the ryzen variants that were launched in China to be launched here but either way it's still a steal for a deal like this. The only issue is if they provided another fan, instead of a single fan system would have been good cuz I live in a very hot area. The temps go high as 98° for 1-2 seconds during a very high load and then goes down at 75° immediately after the fan kicks in. Noise of the fan is not noticeable even at high speed. Overall a bank for the buck. Now the only thing left is after sale service and how long this last before its first breakdown.Low sound in speakers can be fixed by selecting gaming mode in dts app coming preinstalled with the laptop.",1
Please don't buy this product .Pros:Nice screenSlimMac book feel16GB i7 is superfastCons:Build feels poor in the bottom.The grill vent in the bottom is very poor and can bend even with mild press.Speakers sound is lowSpeakers get blocked on soft surfaces and you don't hear anything.Battery performance is 30 percent less than what they claim on website.After One month..The laptop is NOMORE running on the battery.It gets turned off when I remove charger. I should take to it service center now and feel ashamed for buying such poor product.Please buy a better one.,1
"Bought the Mi Ultra laptop during the first sale on 31st Aug. Extremely disappointed with the laptop as well as Mi Support.12/09: Laptop doesn't turn on anymore. It has been 10 days, so cannot even return it. On the 6th day, the laptop went into a continuous restart loop which I fixed with hard shut down 3 times after watching some YouTube videos. And then it was working okay for 2 days. Now it doesn't even start. The charge light also doesn't come on. Nothing happens on pressing the power button. Nothing happens when you connect the charger. It's dead. Need to take it to the service center just 10 days into the purchase! Don't buy this, all the great specs are useless if it doesn't start!Update 13/09: I gave it for service and they are saying the battery and motherboard is defective and they need to replace it! I'm shocked. It's a brand new laptop and in 10 days the battery and motherboard is gone? How can that happen? I've hardly even used it! And they also say that since it's a new laptop the parts are taking time to come to the service center! Better to buy a reliable HP, Dell, Lenovo laptop even if it's a bit more expensive!Update 20/09: It has been with Mi service center for 8 days now. Everytime I call them they say it will get fixed in 2 days. On probing further they said there is a hardware problem. The battery and motherboard needs to be replaced! Wow I can't understand how the battery and motherboard can have problems in just 10 days of purchase? It's clearly a manufacturing defect from Xiaomi. They say they have ordered the parts but they haven't received it since it's a new model! Unbelievable!Just lost lot of money and peace with this laptop! Don't trust Xiaomi from now.23/09: They called me from the service center and asked me to collect a replacement laptop. I got a brand new laptop unopened and I opened it and checked in the service center itself. It seems that they couldn't fix the old laptop and had to send it back, so I got lucky. Else, I would have got a repaired one.Anyway, I'm happy I got a new replacement laptop and currently it's working well.",1
This laptop is for productivity based people. Decent for gaming but not for gamers. Display quality is just amazing to watch videos. Having highest resolution has created compatibility issues with few softwares.Light in weight. Easy carrying but the only and biggest con is the sound quality. 2W sound is absolutely not enough. Mobiles have high sound than this laptop. You may have to connect to additional device like bluetooth speaker to compensate that sound and quality. Apart from that this is one of the best if not the best laptops within the range for productivity purpose.,1
"I am writing this review after 3 month of use.Boots up quickly, finger print is quick.Screen is awesome bright crisp & clear.Performance was a good part of this laptop with good key quality.windows 11 upgrade is free along with MS office student lifetime free accesssolid build with aluminium alloy frame.Battery last longer no heating issue so farOnly thing disappoints is 3rd party sourced charger not an Xiaomi charger on box",1
"Overall product is good, but charger is missing in package, and web cam is very bad quality",1
"I bought around a month back and writing my review based on my daily usage of 2-3 hours.Also, I have MacBook Air 2015 edition and comparing few aspects with it.Pros:1. Fast boot2. No heating issue even after using for 2-3 hrs3. Finger sensor is working good4. Good Battery life5. Aluminium bodyCons:1. Few keys like ""Shift"", ""arrow keys"", ""Home"", ""End"", ""Pgup"", ""PgDn"" keys are not correctly placed in Keyboard. Need some practise to use new KB layout.2. Mouse trackpad is not so sensitive as the MacBook one.3. Sleep mode option is consuming some battery.4. Buy from MI website as they offer few additional offers like Extended warranty, Insurance, additional cashback",1
 It keeps crashing randomly.,1
"I received the product on 17-Oct-2021, setup the user account in Windows, within 3 hours, the entire display got pixelated & system was not responding. The same problem happened again on 24-Oct-2021.Waste of Money.Waste of Time.",0
"Speaker is too low and week. you simply cant here anything, less than mobile sound. i dont know what stops xiaomi to add good speaker to this device?... Xiaomi should give me bluetooth speaker FREE.",1
"The laptop initially had heating issues. Gave it to the service center where the heat sink was replaced as it was defective. Then I started to face backlight screen bleeding issues. The engineers at the service center told me that it's how the laptop is manufactured. Utter crap! And now I'm facing issues with the bluetooth. Again gave it to the service center where a wifi-bluetooth card needs to be replaced. I mean what is going on. A brand new laptop worth Rs. 64,000/- and I'm already facing so many issues. A huge waste of money and peace. I'm pretty sure my unit is defective and everytime Xiaomi replaces the defective part and gives it back to me. I mean imagine that feeling you get of buying a new laptop just to repair it multiple times and use it. The laptop has spent more time in the service center than with me. Pretty sad situation!",1
"Got it delivered today, the build quality is great, display is amazing. Performance is also good.Only disappoinment is with sound. It is very low, even ur mobile sound could be louder then this. Xiaomi should definitely work on this.",0
"Pehli baat to is laptop ko buy karna hi Mahabharat hai.Not available anywhere in NCR region i5/16gb. Just imagine not available in capital city!!Luckily i got from Amazon which took 8 days to deliver since it wasn't on stock.About the laptop its beauty!! hats off to Xiaomi for this. As RAM is not upgradable, never buy 8gb version.",0
"When i was setting it up..and installing windows updates it crashed two times and rebooted,after then windows Hello sign in feature was disabled automatically, fingerprint was working fine for first five days and then it showed error Message as this feature is unavailable..Raised a replacement request with Amazon and thank to supportive staff they barely took 15 min to create a replacement order thanks Amazon.I i bought mi notebook ultra i7 varient.Apart from this software bug laptop is really awesome..it has this flagship display. Build quality is awesome too.. battery life was decent for my working (around 7-8 hours) over all for 68k it was a steal deal for me..",1
"okay got the ultra today and the display is not as amazing as advertised imho. It is extremely sharp (thanks to the 2000p display!) but not at all color accurate. So over saturated that it gives mi and realme phone camera vibes lol. Another example after the iPhone 11 that proves higher resolution != better display.I have an old hp pavilion 14 x360 (14inch 1080p), LG 22MK600M monitor (22 inch IPS LCD 1080p), Lenovo L24i-30 monitor (24 inch IPS LCD 1080p) to compare with and have to say color reproduction is not at all natural on the Mi laptop. And yeah it is the worst of the 4 with Lenovo at 3rd HP 2nd and LG the best. I tested with the famous costa rica 4k video and the greens and yellows on the snake at 0: 07 are so so poor that it almost feels like one bright green. Even looking at the long shots of the trees you can tell the display is so over saturated. Especially looking side by side with others, the differences could easily be spotted (tbh there's no need to look side by side either. you can tell easily, unless you're coming from a TN panel).However everything else about the laptop is great (would've loved ryzen but it's okay considering intel iris xe). 16GB ram with i5 is a combination most tasks find useful but rarely available. Quality of life features like Battery life, thunderbolt, type-c charging, fp scanner, large track-pad and better than average keyboard (I'm used to mechanical so can't appreciate much). Restart takes like 15sec max. wake up from sleep is instant. excellent build (although my hp x360 is good too, so it's not as 'awe'ing to me). the hinge is so satisfying. It's all top notch. Only display didn't reach the expectation.",1
"It has got a great built and macbook like looks.Excellent weight distribution but kind of slippery.I experienced a screen flickering issue on the last day of return period. The laptop flickered & got frozen, nothing worked after that. I restarted it worked again & then after 15 minutes on Ms Word same thing happened. Nothing was visible during this issue black and white horizontal lines and laptop wasn't responsive. I fortunately got it returned & refunded.Cheap quality charger, heats up a lot with little use.Xiaomi needs to be more reliable in laptop section. Too much cost cutting spoils the whole thing.",1
"Please do not buy this brand laptop. I bought it on 16 March. After 3 months of using it, i can definitely say it is not worth buying. I have i5 11th gen 16gb 512gb varient. Still it hangs sometime even when i am not using internet on it. While watching videos, it hangs sometimes. And now it's screen is not working properly. The quality of screen was good but now it is not working all black. WTF. Only 3 month working screen. Now I have to go back and forth to mi center to claim warranty. I don't have time for that. Even most of you too.Always buy laptop from the brand who have name in their field. They are new and giving nothing right now.",1
Everything awesome about the laptop. It gives definite mac feeling except the logo. But the battery does not sustain atleast more than 3 hours with normal usage.,1
"Speakers are too worst that you will feel to buy a 20 k basic laptop instead of wasting huge amount on this.Seeing issue in Bluetooth, getting crack soundTouch pad is not so well.Only build is elligent and screen is good..other than that i don't see much use in this.initiated return after 1 hour of unboxing this laptop, but even to returning is not that easy,it's been two days am following up ..mi customer service is too worst please don't even expect that they will respond to you, they said you bought from Amazon we can't even take any complaints.and when spoke with Amazon they said they will send the technician then only return will be approved, even technician dint come instead he asked to record and send in watsapp.finally Amazon helped me in validating with speaker issue and now initiated the return.",1
" My experience after using laptop after 15 days. After 10 days using Mi notebook ultra, unfortunately my laptop screen starts flickering. I went to service centre.They told me that they are not servicing laptop and asked me to go to other centre. I raised my complaint through tollfree number. Without any intimation they closed the complaint and I left without any solution till now.",1
 The laptop is extremely well builtI have i5 8gb variant as 16 gb was out of stock.1) performance is great for this price range is great2) battery life is also good for an instance i started at 9 in the morning at 100% and it lasted for 2 pm.In meanwhile i was continuously using it at 90hz 3 tabs were open in chrome and it was connected to wifi and Bluetooth display brightness was 50% as i was indoor.3) Gaming I don't do heavy gaming but i played valorant on it at 1080p  low graphics and it was giving around 50 to 80 fps . maybe 16 gb varient will give 60 to 90%.4) Charging while using it takes around 3 hours.5) speakers are a little bit low but i didn't faced any problem as i always use earphones or headphones.6) heating i didn't faced any major heating issue.I tried 4k video rendering and valorant but the temperature never exceeded 80°C . As i am coming from acer Predator it was really good because in Predator temperature is around 95+ while gaming or editing.But after two days when i was doing a typing test its tab key poped out of keyboard.So immediately contact Amazon and hopefully they raised an return.This time i will wait for 16gb.,0
Opened my laptop first time instantly noticed dead pixels all over the laptop disappointed,1
"Speakers are too worst that you will feel to buy a 20 k basic laptop instead of wasting huge amount on this.Seeing issue in Bluetooth, getting crack soundTouch pad is not so well.Only build is elligent and screen is good..other than that i don't see much use in this.initiated return after 1 hour of unboxing this laptop, but even to returning is not that easy,it's been two days am following up ..mi customer service is too worst please don't even expect that they will respond to you, they said you bought from Amazon we can't even take any complaints.and when spoke with Amazon they said they will send the technician then only return will be approved, even technician dint come instead he asked to record and send in watsapp.finally Amazon helped me in validating with speaker issue and now initiated the return.",0
"The Laptop is the best in the price range.Pros- Performance, Build Quality, Display, Battery, TrackpadCons- Keyboard a little Flimsy with a little flexThe sound problem can be resolved by playing with the DTS Control Panel.",0
"Been using it few days now, it's fast, gets most of the things done. For this price range, I think it's worth it.",1
"Disappointed,Within a time of 1 month or so issues I faced are :* Battery Backup (Used to be about 4 to 6 hours, now I get 2 - 3 hours)* Screen Flickering Issue as in the pic attached.* Random Lines appear on the display sometimes.I can't even get the Mi Support in my area,I request the seller to please help me out.",1
